{
  "contract_version": "corridor-lab.route/v1",
  "route_id": "fictional-linked-instant",
  "label": "Linked instant-payment route template (fictional)",
  "fictional": true,
  "fx_rate": "1.7500",
  "fixed_fee_send": "3.00",
  "percent_fee_bps": "30",
  "fx_spread_bps": "75",
  "liquidity": {"prefunding_amount_send": "6500", "annual_cost_of_capital_bps": "650", "holding_days": "1.4"},
  "outcomes": [
    {"outcome_id": "on-time", "probability": "0.94", "completion": "success", "delay_hours": "1.5", "recovery_amount_send": "0", "recovery_delay_hours": "0"},
    {"outcome_id": "late-success", "probability": "0.04", "completion": "success", "delay_hours": "8", "recovery_amount_send": "0", "recovery_delay_hours": "0"},
    {"outcome_id": "failed-recovered", "probability": "0.02", "completion": "failure", "delay_hours": "2", "recovery_amount_send": "980", "recovery_delay_hours": "12"}
  ]
}
